{
  "$schema": "./phase2-registry.schema.json",
  "schemaVersion": 1,
  "generatedAt": "2026-08-06",
  "selectedFirstRunnable": "ppsspp",
  "expectedSystems": [
    "apple2",
    "amiga",
    "amigacd32",
    "saturn",
    "dreamcast",
    "naomi",
    "atomiswave",
    "ps2",
    "gamecube",
    "wii",
    "psp",
    "3ds",
    "scummvm",
    "jaguar"
  ],
  "engines": [
    {
      "id": "applewin",
      "displayName": "AppleWin libretro",
      "systems": [
        "apple2"
      ],
      "route": "libretro-core",
      "status": "experimental",
      "statusReason": "The exact cross-platform fork now has a byte-identical Android ARM64 libretro compiler/linker proof with all upstream ROM and firmware blobs removed. Runtime remains fail-closed on exact user-supplied firmware, while dependency closure, lawful firmware provenance, legal test content, state behavior, performance, and device qualification remain blocked.",
      "selectedFirstRunnable": false,
      "source": {
        "status": "pinned",
        "repository": "https://github.com/audetto/AppleWin",
        "commit": "2045a52d89363005476e670e45df048655edccf7",
        "archive": "https://github.com/audetto/AppleWin/archive/2045a52d89363005476e670e45df048655edccf7.tar.gz",
        "archiveSha256": "64f76dc39d7ea9f83f506bfaf7ae8b2c28117feb19a59d224debbd3c04df954b",
        "verifiedAt": "2026-08-06",
        "submodules": [],
        "notes": "Pinned Linux/cross-platform AppleWin fork selected by the plan because it contains source/frontends/libretro; it is not the Windows-only upstream release tree."
      },
      "license": {
        "spdx": "GPL-2.0-or-later",
        "distributionGate": "audit-required",
        "dependencyAuditComplete": false,
        "evidence": "Pinned primary AppleWin source headers grant GPL version 2 or, at the recipient's option, any later version; the root LICENSE carries the GPLv2 terms.",
        "notes": "Audit the libretro frontend, bundled libraries, generated files, and every compiled source before distribution."
      },
      "android": {
        "abis": [
          "arm64-v8a"
        ],
        "minApi": 23,
        "integrationEvidence": "build-reproduced",
        "jit": false,
        "multiScreen": false,
        "notes": "The exact source and ImGui font dependency build offline for Android ARM64 with networking disabled. EmuFusion's checksum-locked patch removes all ROM and firmware resources from the binary and loads them only from the app-private system directory. This is qualification packaging evidence, not release approval."
      },
      "firmware": {
        "required": true,
        "requiredForSystems": [
          "apple2"
        ],
        "acceptedHashes": [],
        "notes": "The qualification catalog recognizes one exact six-file Apple IIe Enhanced runtime profile copied only from user storage. EmuFusion distributes none of those bytes. The firmware gate remains false until lawful provenance and device execution are independently evidenced."
      },
      "state": {
        "capability": "libretro-serialize",
        "qualified": false,
        "migrationQualified": false,
        "notes": "Serialization source exists; 100-cycle restore, process-death, and version-migration tests have not run."
      },
      "renderer": {
        "requested": "software",
        "qualified": false,
        "notes": "Software video is expected; pixel format, geometry, and sustained pacing remain untested."
      },
      "legalTestContent": {
        "status": "blocked",
        "sourceRepository": "https://github.com/audetto/AppleWin",
        "sourceCommit": "2045a52d89363005476e670e45df048655edccf7",
        "sourcePath": null,
        "license": "Unresolved for a bootable fixture",
        "artifactSha256": null,
        "notes": "The emulator test suite is not a bootable Apple II title. A source-built, explicitly licensed disk plus legally usable ROM path is still required."
      },
      "build": {
        "recipe": "engines/build_core.sh applewin",
        "proofArtifactPath": "engines/build/arm64-v8a/applewin_libretro.so",
        "proofArtifactSha256": "930dfc035a2c2fd63ad585c9c4dcb8a4a82fd5f13472b92c396c203faa426926",
        "reproducible": false,
        "notes": "October 5: the 16 KiB-aligned source candidate is in normal staging. Two clean builds at the same isolated path match; path independence is not proven. Exact Android 16 KiB loader accepts it and firmware checks pass. No new game/runtime/release qualification; existing gates remain false."
      },
      "gates": {
        "source": true,
        "license": false,
        "dependencies": false,
        "androidArm64": true,
        "firmware": false,
        "legalContent": false,
        "renderer": false,
        "state": false,
        "performance": false,
        "device": false
      },
      "shipped": false
    },
    {
      "id": "puae",
      "displayName": "PUAE",
      "systems": [
        "amiga",
        "amigacd32"
      ],
      "route": "libretro-core",
      "status": "experimental",
      "statusReason": "The exact core now has a byte-identical Android ARM64 interpreter build proof, a hash-bound built-in AROS snapshot, fail-closed user-only CD32 firmware profiles, and a deterministic CC0 boot fixture. AROS source reproduction, dependency rights, device runtime, state, renderer, and performance remain unqualified.",
      "selectedFirstRunnable": false,
      "source": {
        "status": "pinned",
        "repository": "https://github.com/libretro/libretro-uae",
        "commit": "96ebfcfc2c66233ad37f6dc99ee991211dc719ad",
        "archive": "https://github.com/libretro/libretro-uae/archive/96ebfcfc2c66233ad37f6dc99ee991211dc719ad.tar.gz",
        "archiveSha256": "af671aa1b42eb5b97a05b3ac2e57b6f397f3e17bbd0be7ac204636c2321d3cf0",
        "verifiedAt": "2026-08-06",
        "submodules": [],
        "notes": "Top-level archive is pinned; vendored/generated dependency provenance remains a separate gate."
      },
      "license": {
        "spdx": "GPL-2.0-or-later",
        "distributionGate": "audit-required",
        "dependencyAuditComplete": false,
        "evidence": "Pinned primary emulator source files grant GPL version 2 or, at the recipient's option, any later version; COPYING contains the GPLv2 terms. A configuration-specific 227-object inventory and notices now identify the linked vendored components.",
        "notes": "WHDLoad/data rights and exact AROS source-to-ROM provenance remain unresolved, so the distribution gate stays open."
      },
      "android": {
        "abis": [
          "arm64-v8a"
        ],
        "minApi": 23,
        "integrationEvidence": "build-reproduced",
        "jit": false,
        "multiScreen": false,
        "notes": "EmuFusion reproduces the exact pinned core with the NDK 27 AArch64 toolchain and fixed SOURCE_DATE_EPOCH. The conservative proof uses the interpreter; JIT and physical-device performance remain separate gates."
      },
      "firmware": {
        "required": true,
        "requiredForSystems": [
          "amigacd32"
        ],
        "acceptedHashes": [],
        "notes": "Amiga qualification uses the exact built-in AROS image bound by SHA-256 in engines/puae-firmware-policy.json. CD32 fails closed on exact-size, upstream-compatible user files; EmuFusion never packages or downloads proprietary Kickstart/CD32 ROMs. The firmware release gate remains false because the embedded AROS image has not been reproduced from a pinned AROS source revision and lawful user-ROM provenance is not inferred from compatibility hashes."
      },
      "state": {
        "capability": "libretro-serialize",
        "qualified": false,
        "migrationQualified": false,
        "notes": "Large-state determinism, disk changes, and compatibility across engine upgrades must be measured."
      },
      "renderer": {
        "requested": "software",
        "qualified": false,
        "notes": "Software rendering is expected; audio/video pacing and high-resolution Amiga modes remain untested."
      },
      "legalTestContent": {
        "status": "blocked",
        "sourceRepository": "https://github.com/wildonrio/emufusion",
        "sourceCommit": null,
        "sourcePath": "engines/qa/fixtures/puae-minimal",
        "license": "CC0-1.0",
        "artifactSha256": "e5692a1ef7a769936b283b465f1dd965979a2cae1e16e4f8af32e41c310724b1",
        "notes": "A deterministic source-built 880 KiB Amiga boot-block fixture now exists and contains no firmware or game assets. The gate remains false until its exact artifact is exercised on the target device through the packaged core."
      },
      "build": {
        "recipe": "engines/build_core.sh puae",
        "proofArtifactPath": "engines/build/arm64-v8a/puae_libretro.so",
        "proofArtifactSha256": "29d03ec1b442431243fd6e7fbc902a811d130a693c274b673dd3a1c61d0aeadf",
        "reproducible": false,
        "notes": "October 5: the 16 KiB-aligned source candidate is in normal staging. Two clean builds at the same isolated path match; path independence is not proven. Exact Android 16 KiB loader accepts it and embedded firmware checks pass. No new game/runtime/release qualification; existing gates remain false."
      },
      "gates": {
        "source": true,
        "license": false,
        "dependencies": false,
        "androidArm64": true,
        "firmware": false,
        "legalContent": false,
        "renderer": false,
        "state": false,
        "performance": false,
        "device": false
      },
      "shipped": false
    },
    {
      "id": "beetle-saturn",
      "displayName": "Beetle Saturn",
      "systems": [
        "saturn"
      ],
      "route": "libretro-core",
      "status": "experimental",